{"$schema":"schemas/support-release-policy.schema.json","schema_version":"openadapt.support-release-policy/v1","lifecycle_state":"Support","production_projection":false,"maximum_admission_days":7,"release_authority":{"app_id":"4730708","app_slug":"openadapt-release","installation_id":"156835568","bot_user_id":"321543906","bot_login":"openadapt-release[bot]","admission_environment":"support-release-admission","effect_environment":"release-identity","tag_creation_ruleset":"OpenAdapt policy: release tag creation","tag_immutability_ruleset":"OpenAdapt policy: immutable release tags"},"targets":[{"id":"openadapt-tray","repository":"OpenAdaptAI/openadapt-tray","repository_id":"1136122737","claim_scope":"support_openadapt_tray","release_kind":"package","tag_pattern":"refs/tags/v*","artifacts":[{"kind":"python-sdist","media_type":"application/gzip","publish_destinations":["github-release","pypi"]},{"kind":"python-wheel","media_type":"application/zip","publish_destinations":["github-release","pypi"]}]}]}
